{
    "task_id": "ratchet-lane-c-uncovered-typing-inventory",
    "stage": "executor",
    "branch": "ai/task-ratchet-lane-c-uncovered-typing-inventory",
    "commit": "85e13bb",
    "files_changed": [
        ".ai/handoffs/ratchet-lane-c-uncovered-typing-inventory.json",
        ".ai/tasks/ratchet-lane-c-uncovered-typing-inventory.json",
        "src/sattlint/analyzers/_registry_delivery.py",
        "src/sattlint/analyzers/_registry_specs.py",
        "src/sattlint/simulation/__init__.py",
        "src/sattlint/simulation/_runtime_models.py",
        "src/sattlint/simulation/runtime.py"
    ],
    "summary": "Created the missing lane-C task artifacts, extracted simulation result models into a dedicated owned module, added preparatory type-clean registry shim files without touching the concurrently claimed registry.py implementation, and verified the owned devtools and simulation production files with focused pytest and pyright proof.",
    "known_risks": [
        "The registry shim files are not wired into registry.py yet because registry.py remains claimed by concurrent workstreams outside this lane's allowed scope.",
        "Lane D must still move the validated uncovered files into tool.pyright.strict because this lane intentionally left pyproject.toml unchanged.",
        "The repo venv required pyright[nodejs] so the native Windows pyright wrapper could run in this machine configuration."
    ],
    "required_tests": [
        "& \".venv/Scripts/python.exe\" -m pytest --no-cov tests/test_fault_injection.py tests/test_property_based.py tests/test_sfc_simulation.py -x -q --tb=short",
        "& \".venv/Scripts/pyright.exe\" src/sattlint/analyzers/_registry_delivery.py src/sattlint/analyzers/_registry_specs.py src/sattlint/devtools/fault_injection.py src/sattlint/devtools/fuzzer.py src/sattlint/devtools/property_tests.py src/sattlint/simulation/__init__.py src/sattlint/simulation/_runtime_models.py src/sattlint/simulation/runtime.py"
    ],
    "validation_status": {
        "state": "passed",
        "commands": [
            "& \".venv/Scripts/python.exe\" -m pytest --no-cov tests/test_fault_injection.py tests/test_property_based.py tests/test_sfc_simulation.py -x -q --tb=short",
            "& \".venv/Scripts/pyright.exe\" src/sattlint/analyzers/_registry_delivery.py src/sattlint/analyzers/_registry_specs.py src/sattlint/devtools/fault_injection.py src/sattlint/devtools/fuzzer.py src/sattlint/devtools/property_tests.py src/sattlint/simulation/__init__.py src/sattlint/simulation/_runtime_models.py src/sattlint/simulation/runtime.py"
        ],
        "notes": [
            "Focused pytest passed twice after the simulation model extraction and follow-up payload type fix.",
            "Exact future strict-move candidates for lane D: src/sattlint/analyzers/_registry_delivery.py, src/sattlint/analyzers/_registry_specs.py, src/sattlint/devtools/fault_injection.py, src/sattlint/devtools/fuzzer.py, src/sattlint/devtools/property_tests.py, src/sattlint/simulation/__init__.py, src/sattlint/simulation/_runtime_models.py, src/sattlint/simulation/runtime.py."
        ]
    },
    "reviewer_notes": [],
    "status": "validated"
}
